Station_Code,Monitoring_Location,State,Temperature_Min_C,Temperature_Max_C,Dissolved_Oxygen_Min_mgL,Dissolved_Oxygen_Max_mgL,pH_Min,pH_Max,Conductivity_Min_umho_cm,Conductivity_Max_umho_cm,BOD_Min_mgL,BOD_Max_mgL,Nitrate_N_Min_mgL,Nitrate_N_Max_mgL,Fecal_Coliform_Min_MPN_100ml,Fecal_Coliform_Max_MPN_100ml,Total_Coliform_Min_MPN_100ml,Total_Coliform_Max_MPN_100ml,Fecal_Streptococci_Min_MPN_100ml,Fecal_Streptococci_Max_MPN_100ml,extraction_method,table_index
1001,RIVER BEAS AT U/S MANALI,HIMACHAL PRADESH,2.0,24.0,7.8,9.2,7.2,8.2,68.0,380.0,1.0,2.8,0.32,1.15,2.0,170.0,63.0,540.0,2.0,2.0,camelot,0
2601,RIVER BEAS AT D/S MANALI,HIMACHAL PRADESH,2.0,13.0,7.6,9.0,6.5,8.1,58.0,135.0,1.0,2.8,0.32,1.87,110.0,1600.0,920.0,1600.0,2.0,2.0,camelot,0
4444,RIVER BEAS D/S 0F WASTE PR0CESSING FACILITY AT MANALI,HIMACHAL PRADESH,2.0,13.0,7.8,8.8,6.7,7.8,62.0,113.0,1.0,2.8,0.32,1.08,110.0,1600.0,350.0,1600.0,2.0,2.0,camelot,0
4037,RIVER BEAS D/S MANALSU NALLAH,HIMACHAL PRADESH,2.0,14.0,7.9,8.9,6.3,8.0,52.0,137.0,1.0,1.0,0.32,1.74,22.0,110.0,79.0,540.0,2.0,2.0,camelot,0
3866,RIVER BEAS U/S BEF0RE C0NF. 0F MANALSU NALLAH,HIMACHAL PRADESH,2.0,13.0,7.8,9.1,7.0,7.8,51.0,113.0,1.0,1.0,0.32,0.97,23.0,120.0,110.0,430.0,2.0,2.0,camelot,0
2602,"RIVER BEAS, U/S KULLU",HIMACHAL PRADESH,4.0,16.0,7.6,8.7,6.7,7.8,44.0,128.0,1.0,1.0,0.32,0.9,49.0,220.0,240.0,920.0,2.0,2.0,camelot,0
4445,RIVER BEAS D/S 0F  WASTE PR0CESSING FACILITY AT KULLU,HIMACHAL PRADESH,4.0,16.0,7.6,8.4,6.6,7.7,73.0,170.0,1.0,1.6,0.32,0.96,47.0,150.0,280.0,920.0,2.0,2.0,camelot,0
1002,RIVER BEAS D/S KULLU,HIMACHAL PRADESH,4.0,16.0,7.5,8.4,7.2,8.0,77.0,144.0,1.0,1.6,0.32,2.65,110.0,540.0,540.0,1600.0,2.0,2.0,camelot,0
1003,RIVER BEAS D/S AUT,HIMACHAL PRADESH,5.0,16.0,7.5,8.1,7.2,8.2,61.0,129.0,1.0,1.0,0.32,0.77,34.0,280.0,170.0,1600.0,2.0,2.0,camelot,0
1004,RIVER BEAS AT PAND0H DAM,HIMACHAL PRADESH,9.0,26.0,8.3,9.0,7.1,8.3,65.0,205.0,1.0,1.0,0.32,1.06,22.0,79.0,70.0,430.0,2.0,2.0,camelot,0
2603,"RIVER BEAS, D/S PAND0H DAM",HIMACHAL PRADESH,8.0,26.0,8.0,9.3,7.1,8.2,61.0,202.0,1.0,1.0,0.32,1.15,41.0,110.0,210.0,920.0,2.0,2.0,camelot,0
1005,RIVER BEAS AT EXIT 0F  DEHAR P0WER H0USE,HIMACHAL PRADESH,10.0,28.0,8.1,9.1,6.9,8.1,96.0,280.0,1.0,1.0,0.32,0.95,17.0,94.0,63.0,350.0,2.0,2.0,camelot,0
1550,"BEAS RIVER, U/S 0F MANDI T0WN",HIMACHAL PRADESH,6.0,25.0,7.8,9.2,7.2,8.0,80.0,190.0,1.0,1.0,0.32,0.98,23.0,94.0,120.0,430.0,2.0,2.0,camelot,0
1006,RIVER BEAS D/S MANDI T0WN,HIMACHAL PRADESH,8.0,25.0,8.3,9.1,7.0,8.0,84.0,191.0,1.0,1.0,0.51,5.3,41.0,280.0,220.0,1600.0,2.0,2.0,camelot,0
2604,RIVER BEAS AT D/S JAISINGHPUR,HIMACHAL PRADESH,13.0,22.0,8.6,9.4,7.2,8.2,115.0,362.0,1.0,1.0,1.2,4.83,2.0,68.0,110.0,16000.0,2.0,2.0,camelot,0
1007,RIVER BEAS AT D/S ALAMPUR,HIMACHAL PRADESH,13.0,22.0,8.5,9.2,7.3,8.3,123.0,960.0,1.0,1.0,0.98,4.21,2.0,45.0,70.0,9200.0,2.0,2.0,camelot,0
3855,"RIVER BEAS D/S NADAUN BRIDGE, VILL BHAD0LI",HIMACHAL PRADESH,14.0,22.0,6.8,9.3,7.5,8.5,81.0,404.0,1.0,1.2,0.3,2.53,2.0,93.0,39.0,5400.0,2.0,2.0,camelot,0
1292,"RIVER BEAS AT P0NG DAM ,P0NG VILLAGE",HIMACHAL PRADESH,7.0,19.0,8.2,9.1,7.5,8.5,157.0,257.0,1.0,1.0,0.41,3.57,2.0,78.0,220.0,5400.0,2.0,2.0,camelot,1
1009,RIVER BEAS AT D/S P0NG DAM,HIMACHAL PRADESH,8.0,20.0,8.1,9.2,7.4,8.2,158.0,264.0,1.0,1.0,0.73,2.87,2.0,68.0,170.0,5400.0,2.0,2.0,camelot,1
1008,RIVER BEAS AT D/S DEHRAG0PIPUR,HIMACHAL PRADESH,15.0,22.0,6.7,9.2,7.2,8.2,107.0,386.0,1.0,1.0,1.08,3.27,2.0,110.0,40.0,5400.0,2.0,2.0,camelot,1
4435,RIVER BEAS U/S SUJANPUR TIHRA,HIMACHAL PRADESH,15.0,28.0,7.7,9.0,6.9,8.8,241.0,964.0,1.0,4.8,0.32,2.59,2.0,5.0,17.0,170.0,2.0,2.0,camelot,1
4436,RIVER BEAS D/S SUJANPUR TIHRA,HIMACHAL PRADESH,14.9,28.0,7.6,8.8,7.0,8.2,229.0,545.0,1.0,3.6,0.32,3.12,2.0,5.0,17.0,220.0,2.0,2.0,camelot,1
4437,RIVER BEAS U/S NADAUM T0WN,HIMACHAL PRADESH,15.6,27.0,6.7,8.9,7.4,8.3,241.0,3040.0,1.0,2.8,0.3,1.17,2.0,8.0,17.0,170.0,2.0,2.0,camelot,1
4438,RIVER BEAS D/S NADAUN T0WN AFTER C0NFLUENCE 0F MAAN KHAD,HIMACHAL PRADESH,15.5,28.0,7.8,8.9,7.2,8.4,216.0,397.0,1.0,3.4,0.32,1.16,2.0,8.0,21.0,140.0,2.0,2.0,camelot,1
4443,RIVER BEAS AT RAIS0N,HIMACHAL PRADESH,3.0,15.0,7.8,8.7,6.8,8.2,53.0,137.0,1.0,1.0,0.32,0.96,47.0,140.0,220.0,920.0,2.0,2.0,camelot,1
5765,RIVER BEAS D/S NEW BAJAURA BRIDGE,HIMACHAL PRADESH,4.0,16.0,7.5,8.5,7.0,8.1,56.0,281.0,1.0,1.0,0.32,0.84,58.0,140.0,280.0,920.0,2.0,2.0,camelot,1
30083,RIVER BEAS AT TALWARA (P0NG DAM),HIMACHAL PRADESH,17.5,27.0,7.2,10.0,8.1,8.6,174.0,230.0,1.0,2.0,0.37,2.57,11.0,3800.0,46.0,17000.0,2.0,5.0,camelot,1
30084,"RIVER BEAS AT D/S CHANGARWA VILLAGE, (PUNJAB)",PUNJAB,18.0,28.0,5.8,10.7,8.0,8.4,201.0,226.0,1.0,1.1,0.4,2.17,110.0,22000.0,270.0,92000.0,7.0,1400.0,camelot,1
1693,"RIVER BEAS AT TALWARA H/W, PUNJAB",PUNJAB,13.0,33.0,6.7,10.1,7.4,8.2,178.0,244.0,1.0,1.2,0.7,1.2,18.0,46.0,70.0,150.0,,,camelot,1
1694,"RIVER BEAS AT U/S PATHANK0T, PUNJAB",PUNJAB,11.0,34.0,7.7,9.1,7.7,8.3,198.0,359.0,1.0,1.2,0.4,1.11,27.0,93.0,110.0,240.0,,,camelot,1
1010,"RIVER BEAS AT MIRTHAL BRIDGE, GURDASPUR",PUNJAB,11.0,34.0,7.7,9.1,7.5,8.3,204.0,395.0,1.0,1.3,0.6,0.9,26.0,78.0,94.0,170.0,,,camelot,1
1695,"RIVER BEAS D/S PATHANK0T, PUNJAB",PUNJAB,11.0,34.0,7.4,8.9,7.5,8.3,218.0,295.0,1.0,1.2,0.5,1.1,31.0,140.0,120.0,330.0,,,camelot,1
1294,"RIVER BEAS AT 1KM.D/S 0F EFFL. DISH. P0INT AT MUKERIAN , PUNJAB",PUNJAB,15.0,27.0,7.0,9.1,7.6,8.2,203.0,275.0,1.0,1.3,0.7,1.4,27.0,140.0,110.0,340.0,,,camelot,1
1696,"RIVER BEAS U/S G0INDWAL, PUNJAB",PUNJAB,14.0,28.0,8.0,9.2,7.5,8.2,191.0,245.0,1.0,1.2,0.4,1.05,68.0,140.0,220.0,330.0,,,camelot,1
1697,"RIVER BEAS AT HARIKE, PUNJAB",PUNJAB,14.0,28.0,8.1,9.1,7.7,8.2,201.0,256.0,1.0,1.2,0.6,1.31,120.0,210.0,280.0,400.0,,,camelot,1
1011,RIVER BEAS AT G.T. R0AD UNDER BDG. NEAR KAPURTHALA,PUNJAB,16.0,28.0,6.9,9.4,7.8,8.2,190.0,276.0,1.0,1.4,0.5,0.97,63.0,170.0,220.0,380.0,,,camelot,1
1012,RIVER BEAS AT 100M D/S INDUST. DISCH. G0INDWAL,PUNJAB,14.0,28.0,7.9,8.9,7.8,8.1,203.0,264.0,1.0,1.3,0.5,1.1,93.0,170.0,260.0,380.0,,,camelot,1
4164,"RIVER BEAS RIVER, NR VILL KIRI AFGHANA, TEHSIL BATALA, GURDASPUR",PUNJAB,16.0,27.0,6.5,9.2,7.7,8.2,192.0,288.0,1.0,1.3,0.6,1.0,33.0,170.0,140.0,350.0,,,camelot,1
5504,RIVER BEAS AT  KARM0WALA  VILLAGE,PUNJAB,26.0,27.0,7.9,8.8,7.9,8.1,211.0,240.0,1.0,1.2,0.7,0.97,84.0,130.0,260.0,280.0,,,camelot,1
5505,RIVER BEAS AT  CHAMBA KALAN,PUNJAB,26.0,27.0,7.9,9.0,7.9,8.1,208.0,239.0,1.0,1.1,0.7,0.93,70.0,110.0,220.0,370.0,,,camelot,1
5506,RIVER BEAS AT KAMB0H DAHIWALA,PUNJAB,26.0,27.0,7.8,8.9,7.8,8.0,209.0,241.0,1.0,1.1,0.8,0.97,94.0,140.0,280.0,340.0,,,camelot,1
1867,RIVER SUTLEJ BEF0RE C0NF.  WITH RIVER SPITI AT KHAB,HIMACHAL PRADESH,7.0,11.5,9.1,9.4,7.5,8.3,141.0,534.0,1.0,1.0,0.32,1.49,2.0,33.0,9.0,280.0,2.0,2.0,camelot,2
2611,RIVER SUTLEJ AFTER C0NF. WITH RIVER SPIT AT KHAB,HIMACHAL PRADESH,7.0,11.5,9.2,9.5,7.8,8.4,127.0,531.0,1.0,1.0,0.32,1.5,2.0,49.0,7.0,1600.0,2.0,2.0,camelot,2
3872,RIVER SUTLEJ D/S TID0NG HEP,HIMACHAL PRADESH,7.0,11.5,9.0,9.3,7.6,8.4,118.0,505.0,1.0,1.0,0.32,1.19,2.0,350.0,4.0,1600.0,2.0,2.0,camelot,2
4448,RIVER SUTLEJ BEF0RE C0NFLUENCES WITH RIVER TID0NG,HIMACHAL PRADESH,7.5,11.5,9.0,9.3,7.6,8.4,118.0,490.0,1.0,1.0,0.32,1.4,7.0,33.0,17.0,350.0,2.0,2.0,camelot,2
4449,RIVER SUTLEJ AFTER C0NFLUENCES WITH RIVER TID0NG,HIMACHAL PRADESH,7.0,11.5,9.0,9.3,7.8,8.4,122.0,481.0,1.0,1.0,0.32,1.23,5.0,140.0,17.0,350.0,2.0,2.0,camelot,2
4452,RIVER SUTLEJ BEF0RE C0NFLUENCES 0F RIVER BASPA,HIMACHAL PRADESH,7.5,12.0,8.7,9.3,7.5,8.3,119.0,517.0,1.0,1.0,0.32,1.44,2.0,33.0,11.0,350.0,2.0,2.0,camelot,2
3871,RIVER SUTLEJ D/S P0WER H0USE KASHANG HEP,HIMACHAL PRADESH,7.0,12.0,8.9,9.4,7.5,8.5,117.0,491.0,1.0,1.0,0.32,1.39,2.0,110.0,7.0,540.0,2.0,2.0,camelot,2
3870,RIVER SUTLEJ AFTER C0NF. 0F RIVER BASPA AT KARCHAM DAM,HIMACHAL PRADESH,7.0,12.0,8.8,9.3,7.8,8.4,121.0,460.0,1.0,1.0,0.32,1.39,2.0,27.0,8.0,540.0,2.0,2.0,camelot,2
1389,RIVER SUTLEJ AT WANGT00 BRIDGE,HIMACHAL PRADESH,7.5,12.0,8.7,9.3,7.7,8.4,108.0,468.0,1.0,1.0,0.32,1.4,2.0,46.0,9.0,1600.0,2.0,2.0,camelot,2
4453,RIVER SUTLEJ AFTER C0NFLUENCES 0F RIVER BASPA,HIMACHAL PRADESH,7.0,12.0,8.7,9.3,7.5,8.4,115.0,437.0,1.0,1.0,0.32,1.43,5.0,22.0,17.0,350.0,2.0,2.0,camelot,2
3869,RIVER SUTLEJ D/S TRT 0F RAMPUR HYDEL ELECTRIC PR0JECT,HIMACHAL PRADESH,7.5,13.5,8.7,9.2,7.5,8.3,105.0,254.0,1.0,1.0,0.32,1.42,7.0,170.0,17.0,1600.0,2.0,2.0,camelot,2
1086,RIVER SUTLEJ AT U/S RAMPUR,HIMACHAL PRADESH,7.5,13.0,8.5,9.3,7.7,8.3,107.0,251.0,1.0,1.0,0.32,0.95,2.0,39.0,17.0,350.0,2.0,2.0,camelot,2
1087,RIVER SUTLEJ AT D/S RAMPUR,HIMACHAL PRADESH,8.0,13.5,8.6,9.2,7.6,8.3,100.0,249.0,1.0,1.0,0.32,0.95,2.0,280.0,5.0,1600.0,2.0,2.0,camelot,2
1013,RIVER SUTLEJ AT U/S TATAPANI,HIMACHAL PRADESH,7.5,14.0,8.6,9.3,6.5,8.2,117.0,447.0,1.0,1.0,0.32,3.95,4.0,26.0,17.0,1600.0,2.0,2.0,camelot,2
4446,RIVER SUTLEJ U/S IANDFILL SITE RAMPUR,HIMACHAL PRADESH,7.0,13.0,8.5,9.3,7.5,8.3,97.0,245.0,1.0,1.0,0.32,0.77,7.0,39.0,32.0,920.0,2.0,2.0,camelot,2
4447,RIVER STLUJ D/S LANDFILL SITE RAMPUR,HIMACHAL PRADESH,7.5,13.0,8.6,9.2,7.5,8.2,104.0,253.0,1.0,1.0,0.32,0.89,2.0,79.0,7.0,1600.0,2.0,2.0,camelot,2
4032,RIVER SUTLEJ D/S ACC BARMANA,HIMACHAL PRADESH,9.0,26.0,8.3,9.2,7.4,8.0,102.0,235.0,1.0,1.0,0.32,2.21,23.0,84.0,110.0,280.0,2.0,2.0,camelot,2
4033,RIVER SUTLEJ NEAR LUHN00 GR0UND,HIMACHAL PRADESH,10.0,33.0,8.1,8.9,6.8,8.3,150.0,335.0,1.0,2.8,0.39,3.5,33.0,1600.0,240.0,1600.0,2.0,2.0,camelot,3
4450,RIVER SUTLEJ BEF0RE C0NFLUENCE WITH GANVI KHAND,HIMACHAL PRADESH,7.0,13.0,8.9,9.4,7.5,8.3,117.0,258.0,1.0,1.0,0.32,1.01,5.0,26.0,17.0,350.0,2.0,2.0,camelot,3
4451,RIVER SUTLEJ AFTER C0NFLUENCE WITH GANVI KHAD,HIMACHAL PRADESH,7.5,13.0,8.9,9.4,7.6,8.2,100.0,248.0,1.0,1.0,0.32,0.82,7.0,110.0,17.0,1600.0,2.0,2.0,camelot,3
30009,RIVER SUTLEJ AT NANGAL (H.P.),HIMACHAL PRADESH,16.5,23.0,7.0,9.8,7.9,8.3,230.0,356.0,1.0,1.0,0.42,0.71,20.0,4500.0,460.0,33000.0,17.0,130.0,camelot,3
1014,RIVER SUTLEJ U/S 0F EXIT P0INT 0F DEHAR P0WER H0USE,HIMACHAL PRADESH,9.0,26.0,8.5,9.6,5.7,8.0,96.0,286.0,1.0,1.0,0.32,0.98,22.0,49.0,70.0,240.0,2.0,2.0,camelot,3
1015,RIVER SUTLEJ D/S 0F EXIT P0INT 0F DEHAR P0WER H0USE,HIMACHAL PRADESH,9.0,26.0,8.1,9.1,7.3,8.1,94.0,240.0,1.0,1.0,0.32,2.08,32.0,84.0,110.0,430.0,2.0,2.0,camelot,3
1016,RIVER SUTLEJ D/S BHAKHRA,HIMACHAL PRADESH,16.0,26.0,8.2,9.3,6.9,8.3,203.0,354.0,1.0,2.3,0.32,0.93,2.0,6.0,13.0,80.0,2.0,2.0,camelot,3
30087,"RIVER SUTLEJ U/S AT 0LINDA, NEAR BHAKRA DAM, H.P.",HIMACHAL  PRADESH,19.0,23.0,7.0,10.7,7.9,8.4,223.0,273.0,1.0,1.0,0.42,2.47,2.0,2600.0,13.0,54000.0,2.0,17.0,camelot,3
30088,"RIVER SUTLEJ D/S 0LINDA, NEAR BHAKRA DAM, H.P.",HIMACHAL PRADESH,18.5,23.0,7.1,10.4,8.0,8.3,217.0,272.0,1.0,1.0,0.47,1.13,4.0,2200.0,14.0,92000.0,2.0,490.0,camelot,3
30010,RIVER SUTLEJ AT N00RPUR BEDI R0AD (PUNJAB),PUNJAB,19.5,24.0,7.1,9.8,7.7,8.3,257.0,333.0,1.0,5.0,0.32,1.1,200.0,13000.0,1700.0,350000.0,130.0,700.0,camelot,3
1814,"RIVER SUTLEJ AT D/S KIRATPUR SAHIB, PUNJAB",PUNJAB,14.0,28.0,7.2,9.4,7.0,8.3,227.0,290.0,1.0,1.0,0.7,5.9,33.0,250.0,120.0,580.0,,,camelot,3
1380,"RIVER SUTLEJ AT D/S NFL, PUNJAB",PUNJAB,16.0,22.0,7.0,12.1,7.4,8.3,206.0,274.0,1.0,1.0,0.8,3.1,17.0,100.0,70.0,330.0,,,camelot,3
2915,"RIVER SUTLEJ AT 100 MT. D/S 0F PACL, NANGAL",PUNJAB,16.0,22.0,7.0,12.2,7.6,8.4,207.0,275.0,1.0,1.0,0.8,3.1,20.0,110.0,79.0,330.0,,,camelot,3
10020,RIVER SUTLEJ AT ANANDPUR SAHIB,PUNJAB,15.0,23.0,7.4,12.3,7.1,8.5,202.0,298.0,1.0,1.0,0.9,6.0,22.0,210.0,110.0,470.0,,,camelot,3
10021,RIVER SUTLEJ AT BUNGA SAHIB,PUNJAB,13.0,28.0,7.5,10.0,7.0,8.3,210.0,302.0,1.0,1.0,0.9,2.4,38.0,380.0,140.0,840.0,,,camelot,3
10022,RIVER SUTLEJ AT PHILLAUR U/S,PUNJAB,15.0,35.0,4.6,8.4,7.6,8.1,248.0,574.0,1.0,3.0,0.3,1.4,200.0,1700.0,700.0,3900.0,,,camelot,3
10023,RIVER SUTLEJ AT PHAGWARA U/S (CHAHERU BRIDGE),PUNJAB,15.0,35.0,0.3,5.8,7.2,8.1,518.0,1144.0,4.5,14.0,0.4,2.8,330.0,2300.0,1400.0,4300.0,,,camelot,3
10024,RIVER SUTLEJ AT PHAGWARA D/S (KANGANIWAL BRIDGE),PUNJAB,15.0,32.0,0.3,1.9,7.3,7.8,538.0,1248.0,4.8,21.0,0.4,2.0,1100.0,110000.0,6300.0,340000.0,,,camelot,3
10027,RIVER SUTLEJ AT LUDHIANA U/S,PUNJAB,10.0,29.0,6.3,8.8,7.6,8.3,257.0,320.0,1.0,1.8,0.8,3.1,130.0,780.0,700.0,2600.0,,,camelot,3
10028,RIVER SUTLEJ AT LUDHIANA D/S,PUNJAB,13.0,30.0,0.3,6.6,7.2,7.9,247.0,1245.0,2.3,75.0,1.4,3.8,17000.0,1700000.0,54000.0,6300000.0,,,camelot,3
1017,"RIVER SUTLEJ AT 100M U/S 0F HEADW0RKS, NANGAL",PUNJAB,16.0,21.0,6.7,9.6,7.5,8.1,196.0,264.0,1.0,1.0,0.4,1.8,17.0,78.0,68.0,270.0,,,camelot,3
1018,"RIVER SUTLEJ AT 100M D/S , NANGAL",PUNJAB,17.0,24.0,7.6,11.4,7.6,8.5,200.0,270.0,1.0,1.0,0.8,2.2,20.0,170.0,70.0,390.0,,,camelot,3
1293,"RIVER SUTLEJ AT 1 KM. D/S 0F ZENITH, PUNJAB",PUNJAB,14.0,29.0,7.0,9.8,7.3,8.5,243.0,363.0,1.0,1.0,0.7,2.7,78.0,700.0,490.0,1700.0,,,camelot,3
1019,RIVER SUTLEJ AT U/S HEAD W0RKS R0PAR,PUNJAB,14.0,27.0,6.4,9.0,7.5,8.2,240.0,348.0,1.0,1.2,1.1,2.6,61.0,460.0,330.0,1300.0,,,camelot,4
1690,"RIVER SUTLEJ AT U/S BUDHA NALLAH (UPPER), PUNJAB",PUNJAB,12.0,28.0,6.5,8.1,7.4,8.2,259.0,394.0,1.0,2.8,1.1,3.3,210.0,1300.0,790.0,3900.0,,,camelot,4
1020,"RIVER SUTLEJ AT 100M D/S BUDHA NALA C0NFL., LUDHIANA",PUNJAB,12.0,30.0,0.3,2.1,7.2,7.8,505.0,1250.0,17.0,105.0,1.1,8.0,79000.0,2200000.0,220000.0,7900000.0,,,camelot,4
1022,"RIVER SUTLEJ AT BRIDGE HARIKE, AMRITSAR",PUNJAB,11.0,30.0,4.2,7.5,7.2,7.9,271.0,442.0,1.0,3.6,1.1,3.2,270.0,2200.0,700.0,5400.0,,,camelot,4
10025,RIVER SUTLEJ AT JALANDHAR U/S (PEERU SHAH KA DARGAH),PUNJAB,15.0,34.0,0.3,0.3,6.9,7.8,937.0,1165.0,42.0,100.0,1.1,2.8,63000.0,490000.0,220000.0,790000.0,,,camelot,4
10026,RIVER SUTLEJ AT JALANDHAR D/S (MALSIAN BRIDGE),PUNJAB,16.0,31.0,0.3,0.3,6.7,7.7,849.0,1309.0,35.0,79.0,0.82,5.0,63000.0,460000.0,210000.0,700000.0,,,camelot,4
1021,"RIVER SUTLEJ AT B0AT BDG. DHARMK0TNAK0DAR R0AD, JALANDHAR",PUNJAB,11.0,28.0,0.3,7.6,7.1,7.8,305.0,733.0,2.2,41.0,1.3,4.6,4900.0,1200000.0,17000.0,2800000.0,,,camelot,4
1381,"RIVER SUTLEJ AT D/S EAST BEIN, PUNJAB",PUNJAB,12.0,29.0,0.3,7.8,7.1,7.8,300.0,808.0,2.0,50.0,1.7,6.3,7900.0,1700000.0,17000.0,3500000.0,,,camelot,4
1691,"RIVER SUTLEJ AT U/S HUSSANIWALA - H/W FER0ZEPUR,PUNJAB",PUNJAB,12.0,30.0,4.8,9.1,7.0,8.1,248.0,422.0,1.0,2.0,1.1,2.6,110.0,780.0,540.0,2600.0,,,camelot,4
1692,"RIVER SUTLEJ AT D/S HUSSANIWALA-H/W FER0ZEPUR, PUNJAB",PUNJAB,12.0,30.0,4.7,8.9,6.9,8.0,251.0,420.0,1.0,2.4,1.2,2.8,170.0,1100.0,540.0,2700.0,,,camelot,4
4059,"RIVER RAVI AT RANJIT SAGAR DAM, AT PANAGAR (BAS0HIL)",JAMMU & KASHMIR,12.0,26.0,7.4,7.5,7.5,8.2,109.0,230.0,1.0,1.0,0.0,0.0,,,,,,,camelot,5
4060,RIVER RAVI AT DAM-SITE AT THEIN,JAMMU & KASHMIR,12.0,26.0,7.4,7.4,7.4,8.2,107.0,185.0,1.0,1.0,0.0,0.0,,,,,,,camelot,5
4061,"RIVER RAVI AT LAKHANPUR, 1 KM D/S FR0M MADH0PUR BRIDGE",JAMMU & KASHMIR,12.0,26.0,6.3,6.5,7.6,8.6,108.0,560.0,1.0,1.3,0.0,0.0,,,,,,,camelot,5
1089,RIVER RAVI U/S CHAMBA,HIMACHAL PRADESH,10.0,18.0,8.7,9.1,7.5,8.4,141.0,276.0,1.0,1.0,0.3,6.43,2.0,68.0,21.0,16000.0,2.0,2.0,camelot,5
1088,RIVER RAVI AT U/S MADH0PUR,HIMACHAL PRADESH,9.0,22.0,8.1,9.0,7.4,8.2,164.0,467.0,1.0,1.0,0.3,4.58,2.0,20.0,130.0,1400.0,2.0,2.0,camelot,5
2614,RIVER RAVI  CHAMERA-I RESERV0IR,HIMACHAL PRADESH,11.0,17.5,8.5,9.2,6.9,8.2,158.0,286.0,1.0,1.0,0.31,2.18,2.0,27.0,110.0,5400.0,2.0,2.0,camelot,5
2615,RIVER RAVI  D/S  CHAMERA- III HEP DAM,HIMACHAL PRADESH,9.0,17.0,8.9,9.2,7.1,8.3,136.0,274.0,1.0,1.0,0.41,3.61,2.0,40.0,27.0,3500.0,2.0,2.0,camelot,6
2613,RIVER RAVI AT D/S 0F CHAMBA T0WN,HIMACHAL PRADESH,10.0,17.0,8.0,9.0,7.5,8.1,130.0,266.0,1.0,1.0,0.3,3.23,2.0,78.0,26.0,16000.0,2.0,2.0,camelot,6
3873,RIVER RAVI U/S STP AT BHARGA,HIMACHAL PRADESH,10.0,17.5,8.8,9.1,7.5,8.4,142.0,281.0,1.0,1.0,0.59,4.71,2.0,40.0,21.0,9200.0,2.0,2.0,camelot,6
3874,RIVER RAVI D/S STP AT BHAG0T,HIMACHAL PRADESH,10.0,18.5,8.3,9.0,7.5,8.3,140.0,264.0,1.0,1.0,0.3,3.06,2.0,110.0,32.0,9200.0,2.0,2.0,camelot,6
30089,"RIVER RAVI AT LAKHANPUR,",JAMMU & KASHMIR,19.0,31.0,8.7,10.8,8.0,8.7,175.0,351.0,1.0,3.0,0.32,0.83,2200.0,24000000.0,7000.0,160000000.0,11.0,540000.0,camelot,6
30085,RIVER RAVI AT MADH0PUR,PUNJAB,18.0,24.0,9.0,10.0,7.9,8.4,172.0,237.0,1.0,1.3,0.39,1.79,37.0,28000.0,400.0,28000.0,13.0,790.0,camelot,6
1097,"RIVER RAVI AT U/S 0F MADH0PUR HEADW0RKS, GURDASPUR, PUNJAB",PUNJAB,11.0,34.0,8.1,10.2,7.5,8.2,152.0,207.0,1.0,1.1,0.4,1.2,18.0,40.0,70.0,140.0,,,camelot,6
1290,RIVER PARVATI BEF0RE C0NF. T0 RIVER BEAS AT BHUNTER,HIMACHAL PRADESH,4.0,16.0,7.0,8.6,6.5,8.1,42.0,100.0,1.0,1.0,0.32,0.85,43.0,170.0,220.0,920.0,2.0,2.0,camelot,6
1090,RIVER SAINJ D/S LARJI,HIMACHAL PRADESH,6.0,15.0,7.4,8.2,7.0,8.0,60.0,145.0,1.0,1.0,0.32,0.84,22.0,110.0,94.0,920.0,2.0,2.0,camelot,6
2605,RIVER PARVATI AT U/S MANIKARAN,HIMACHAL PRADESH,3.0,15.0,7.2,8.8,6.8,8.3,40.0,94.0,1.0,1.0,0.32,1.06,17.0,47.0,63.0,220.0,2.0,2.0,camelot,6
2606,RIVER PARVATI AT D/S MANIKARAN,HIMACHAL PRADESH,3.0,16.0,7.1,8.7,6.8,8.0,42.0,100.0,1.0,1.0,0.32,1.23,22.0,94.0,70.0,350.0,2.0,2.0,camelot,6
1551,RIVER SIRSA U/S SIT0MAJRI NALLAH,HIMACHAL PRADESH,12.0,23.0,5.8,7.1,7.4,8.2,331.0,766.0,1.0,7.2,1.73,15.8,2.0,920.0,26.0,1600.0,2.0,2.0,camelot,6
1552,RIVER SIRSA D/S NALAGARH BRIDGE,HIMACHAL PRADESH,12.0,26.0,5.5,7.1,7.3,8.1,408.0,1436.0,1.0,6.0,2.62,15.54,4.0,920.0,21.0,1600.0,2.0,2.0,camelot,6
1868,RIVER SIRSA  D/S NALAGARH  T0WN,HIMACHAL PRADESH,11.0,26.0,3.4,7.1,7.1,8.1,403.0,1611.0,1.0,3.9,3.05,15.31,2.0,540.0,26.0,1600.0,2.0,2.0,camelot,6
4485,RIVER SIRSA U/S SANDH0LI NALLAH,HIMACHAL PRADESH,11.0,24.0,6.0,7.1,7.5,8.2,329.0,768.0,1.0,3.8,1.86,11.86,4.0,46.0,34.0,920.0,2.0,2.0,camelot,6
4486,RIVER BALD D/S LANDFILLSITE AT BADDI,HIMACHAL PRADESH,12.0,24.0,4.0,7.6,7.2,8.1,302.0,1754.0,1.0,24.0,1.4,9.23,2.0,1600.0,12.0,1600.0,2.0,2.0,camelot,6
4487,RIVER SIRSA D/S H0USING B0ARD NALLAH,HIMACHAL PRADESH,11.0,25.0,3.0,6.9,7.6,8.2,360.0,1913.0,1.0,16.0,1.48,14.24,7.0,1600.0,39.0,1600.0,2.0,9.0,camelot,6
4489,RIVER SIRSA AFTER C0NF. T0 RIVER RATTA,HIMACHAL PRADESH,12.0,24.0,5.2,7.1,7.7,8.3,418.0,1385.0,1.0,5.6,1.93,12.83,4.0,540.0,33.0,1600.0,2.0,2.0,camelot,6
30012,"RIVER SARSA AT BADDI , ,GHAN0LI VILLAGE) PUNJAB",PUNJAB,19.0,27.0,6.0,6.8,7.6,8.1,330.0,1269.0,3.0,45.0,1.27,5.52,3400.0,490000.0,28000.0,1600000.0,1700.0,4900.0,camelot,6
4161,"RIVER C0NFLUENCE P0INT 0F SARSA NADI WITH SUTLEJ, NR VILL ASPUR, R00PNAGAR",PUNJAB,12.0,29.0,6.5,12.2,7.2,8.3,262.0,554.0,1.0,1.2,0.9,4.7,78.0,460.0,210.0,1100.0,,,camelot,6
2616,RIVER BAIRA SIUL  D/S SURGANI,HIMACHAL PRADESH,10.0,16.0,8.7,9.2,6.7,8.1,64.0,283.0,1.0,1.0,0.37,3.32,2.0,14.0,70.0,1700.0,2.0,2.0,camelot,7
2607,SUKETI KHAD BEF0RE C0NF. WITH RIVER BEAS,HIMACHAL PRADESH,10.0,27.0,8.0,8.9,7.1,8.3,210.0,385.0,1.0,2.0,0.32,3.22,63.0,1600.0,350.0,1600.0,2.0,2.0,camelot,7
2608,RIVER BINWA AT D/S PAPR0LA/BAIJNATH,HIMACHAL PRADESH,15.0,20.0,8.6,9.2,7.3,8.2,57.0,294.0,1.0,1.0,0.59,3.1,2.0,40.0,49.0,9200.0,2.0,2.0,camelot,7
2609,NEUGAL KHAD  D/S THURAL,HIMACHAL PRADESH,12.0,22.0,8.5,9.1,7.1,8.5,88.0,283.0,1.0,1.0,0.95,4.18,2.0,45.0,70.0,16000.0,2.0,2.0,camelot,7
2610,RIVER SPITI BEF0RE C0NF.WITH RIVER SUTLEJ AT KHAB,HIMACHAL PRADESH,7.0,11.5,9.2,9.7,7.6,8.4,129.0,509.0,1.0,1.0,0.32,0.82,2.0,70.0,2.0,280.0,2.0,2.0,camelot,7
2612,RIVER BASPA U/S RESERV0IR BASPA HEP AT KUPPA,HIMACHAL PRADESH,7.0,12.0,9.3,9.8,7.5,8.4,104.0,304.0,1.0,1.0,0.32,1.45,2.0,39.0,9.0,280.0,2.0,2.0,camelot,7
5767,RIVER ANDHRA B/C T0 RIVER PABBAR AT CHIRGA0N,HIMACHAL PRADESH,6.0,10.4,7.6,8.7,7.0,8.4,42.0,136.0,1.0,1.0,0.32,0.66,2.0,20.0,2.0,280.0,2.0,2.0,camelot,7
5769,BAN0I KHAD AT KALAPUL 0N CANT R0AD DHARAMSHALA,HIMACHAL PRADESH,12.0,19.0,9.0,9.1,7.5,8.2,79.0,213.0,1.0,1.0,0.69,3.12,2.0,93.0,26.0,5400.0,2.0,2.0,camelot,7
2755,"RIVER BANGANGA (BATHING GHAT), KATRA,",JAMMU & KASHMIR,11.0,22.0,2.6,7.8,8.1,8.8,280.0,487.0,1.0,2.7,0.0,0.77,,,500.0,3000.0,,,camelot,7
2756,RIVER BANGANGA (IN FR0NT 0F P0NY SHED NEAR REASI BRIDGE)KATRA,JAMMU & KASHMIR,11.0,22.0,2.4,6.2,8.0,8.5,264.0,589.0,1.3,3.0,0.0,1.1,,,700.0,3000.0,,,camelot,7
2752,"RIVER BASANTER U/S (R.H.S) SAMBA (BEL0W NH-1A BRIDGE),",JAMMU & KASHMIR,7.8,24.0,4.7,7.2,7.3,8.0,234.0,386.0,1.0,2.3,0.0,0.32,,,700.0,700.0,,,camelot,7
2753,RIVER BASANTER D/S(R.H.S.) SAMBA (AT CHAK MANGA GUJJAR,JAMMU & KASHMIR,14.0,26.0,3.1,6.5,7.5,8.2,224.0,446.0,1.0,3.7,0.0,0.79,,,600.0,1000.0,,,camelot,7
2747,"RIVER TAWI AT SURAJPUR CHATHA(10 KM D/S TAWI BRIDGE)BEL0W BRIDGE NEAR CHATHA MSW DUMPING SITE, J&K",JAMMU & KASHMIR,17.0,26.0,6.7,7.2,7.6,8.4,160.0,324.0,1.0,1.0,0.0,0.32,,,600.0,1300.0,,,camelot,7
2748,RIVER CHENAB AT L.H.S.(BEL0W BRIDGE CHENAB),JAMMU & KASHMIR,9.0,16.0,7.2,7.6,7.1,7.5,110.0,224.0,1.0,1.1,0.0,0.32,,,,,,,camelot,7
2749,RIVER CHENAB AT BLIND CURVE SHAMSHAN GHAT (1.5 KM U/S FR0M SP0T),JAMMU & KASHMIR,9.0,16.0,7.2,7.6,7.2,7.5,110.0,206.0,1.0,1.1,0.0,0.32,,,,,,,camelot,7
2750,RIVER CHENAB AT CHADRA GA0N VIEW P0INT(4 KM U/S FR0M SP0T),JAMMU & KASHMIR,9.0,16.0,7.3,7.5,7.2,7.5,110.0,204.0,1.0,1.1,0.0,0.32,,,,,,,camelot,7
2751,RIVER CHENAB AT JAL PATAN MANDIR AFTER MEETING WITH MAIN DRAIN 0F AKHN00R CITY(1.5 KMD/S FR0M SP0T),JAMMU & KASHMIR,9.0,16.0,6.8,7.0,7.3,7.9,114.0,227.0,1.1,1.6,0.0,1.19,,,600.0,1000.0,,,camelot,7
2754,RIVER DEVAK UDHAMPUR(NEAR SHIV MANDIR D/S)L.H.S.,JAMMU & KASHMIR,16.0,26.0,3.1,5.3,7.9,8.2,312.0,627.0,2.3,4.4,0.0,4.32,,,800.0,2000.0,,,camelot,7
2757,RIVER DEVAK AT UTTERBEHNI,JAMMU & KASHMIR,17.0,22.0,6.4,7.3,7.6,8.6,164.0,314.0,1.0,1.0,0.0,0.32,,,,,,,camelot,7
4058,"RIVER DEVAK AT PURMANDAL, NEAR TEMPLE",JAMMU & KASHMIR,17.0,24.0,5.0,7.3,8.3,8.7,412.0,589.0,1.0,1.3,0.0,0.32,,,,,,,camelot,7
4062,"RIVER DEVAK 2 KM D/S FR0M SHIV MANDIR AT UDHAMPUR,",JAMMU & KASHMIR,16.0,26.0,5.8,7.8,7.6,8.3,300.0,542.0,1.0,1.9,0.0,1.55,,,700.0,3000.0,,,camelot,8
4063,"RIVER DEVAK AB0UT 10 KM D/S FR0M SHIV MANDIR, BEL0W RAILWAY BRIDGE, UDHAMPUR",JAMMU & KASHMIR,16.0,26.0,5.6,8.0,7.3,8.5,286.0,420.0,1.0,2.0,0.0,0.32,,,700.0,2000.0,,,camelot,8
4081,SURAN RIVER BEL0W SHER-E-KASHMIR BRIDGE AT P00NCH,JAMMU & KASHMIR,17.0,24.0,7.4,7.6,7.5,7.6,110.0,165.0,1.0,1.0,0.32,0.32,,,,,,,camelot,8
3277,RIVER JHELUM AT BARAMULLA D/S,JAMMU & KASHMIR,5.5,23.0,5.8,9.8,7.4,8.2,160.0,325.0,2.5,3.8,0.0,0.0,,,,,,,camelot,8
1410,"RIVER JHELAM AT DALAGATE (INLET), SRINAGAR",JAMMU & KASHMIR,6.1,25.1,4.6,8.9,7.3,8.0,155.0,366.0,1.9,5.9,0.0,0.0,,,,,,,camelot,8
1411,RIVER JHELAM AT CHATTABAL WEIR (0UTLET,JAMMU & KASHMIR,7.3,25.1,4.1,8.2,7.3,8.1,154.0,371.0,2.9,7.8,0.0,0.0,,,,,,,camelot,8
3272,RIVER JHELUM AT VERINAG,JAMMU & KASHMIR,7.0,19.5,6.0,9.7,7.1,7.9,152.0,351.0,1.0,4.2,0.0,0.0,,,,,,,camelot,8
3273,"RIVER JHELUM AT SANGAM, C0NFLUENCE P0INT 0F VISHAV NALLAH",JAMMU & KASHMIR,8.0,22.0,5.9,9.0,7.7,8.0,120.0,281.0,1.8,4.4,0.0,0.0,,,,,,,camelot,8
3274,RIVER JHELUM AT AWANTIP0RA,JAMMU & KASHMIR,7.5,22.2,6.0,9.9,7.5,8.1,118.0,297.0,2.0,3.2,0.0,0.0,,,,,,,camelot,8
3275,RIVER JHELUM AT PAMP0RE,JAMMU & KASHMIR,7.6,22.1,5.9,9.8,7.3,8.1,114.0,312.0,2.1,4.2,0.0,0.0,,,,,,,camelot,8
3276,"RIVER JHELUM AT S0P0RE, C0NFLUENCE P0INT 0F WULAR LAKE",JAMMU & KASHMIR,5.0,23.4,6.0,10.8,7.3,8.2,153.0,354.0,1.6,3.2,0.0,0.0,,,,,,,camelot,8
4053,RIVER JHELUM AT BIJEHARA,JAMMU & KASHMIR,8.4,22.8,5.3,9.4,7.6,7.9,121.0,310.0,2.0,3.8,0.0,0.0,,,,,,,camelot,8
4054,RIVER JHELUM AT PANTHACH0WK,JAMMU & KASHMIR,7.5,22.3,5.5,9.9,7.5,8.0,114.0,316.0,2.0,32.0,0.0,0.0,,,,,,,camelot,8
2742,RIVER TAWI AT SHETALI LIFTING P0INT NAGR0TA(5KM U/S TAWI BRIDGE),JAMMU & KASHMIR,16.0,26.0,7.2,7.6,7.3,8.2,166.0,455.0,1.0,1.0,0.0,0.32,,,,,,,camelot,8
2743,RIVER TAWI AT BAGH-E-BAHU LIFTING P0INT(1 KM U/S TAWI BRIDGE),JAMMU & KASHMIR,17.0,26.0,6.8,7.5,7.5,8.5,176.0,370.0,1.0,1.0,0.0,0.32,,,,,,,camelot,8
1412,"RIVER TAWI AT JAMMU U/S, (TAWI BRIDGE )",JAMMU & KASHMIR,14.0,28.0,4.8,6.0,7.9,8.4,420.0,442.0,2.0,3.6,0.0,0.26,,,,,,,camelot,8
2744,RIVER TAWI BEL0W TAWI BRIDGE,JAMMU & KASHMIR,17.0,26.0,3.0,7.5,7.9,8.9,185.0,372.0,1.1,4.0,0.0,1.42,,,700.0,800.0,,,camelot,8
2745,RIVER TAWI BAGHWATI NAGAR (2KM D/S TAWI BRIDGE,JAMMU & KASHMIR,17.0,17.0,3.0,3.0,9.0,9.0,176.0,176.0,9.0,9.0,0.0,0.0,,,,,,,camelot,8
2746,RIVER TAWI AT BELICHARANA(4KM D/S TAWI BRIDGE),JAMMU & KASHMIR,17.0,26.0,6.5,7.2,7.9,8.5,156.0,360.0,1.0,1.0,0.0,0.32,,,500.0,1500.0,,,camelot,8
4055,RIVER TAWI AT 1 KM D/S BEL0W STP DISCHARGE P0INTAT BHAGWATI NAGAR,JAMMU & KASHMIR,18.0,18.0,2.3,2.3,8.9,8.9,172.0,172.0,9.5,9.5,0.0,0.0,,,,,,,camelot,8
4056,"RIVER TAWI AT BAL0L NALLAH, NEAR NIT C0LLEGE, MIRAN SAHIB, BEF0RE MIXING",JAMMU & KASHMIR,16.0,28.0,2.9,6.0,7.7,8.2,326.0,612.0,1.0,4.9,0.0,0.31,,,,,,,camelot,8
1307,RIVER CHUNT K0L (MAULANA AZAD BRIDGE),JAMMU & KASHMIR,5.8,24.7,1.1,6.6,7.1,7.8,190.0,382.0,4.5,10.7,0.0,0.0,,,,,,,camelot,9
4030,RIVER SWAN BEF0RE C0NF. 0F GARNI KHAD AT CHURURU,HIMACHAL PRADESH,19.2,32.0,6.6,7.8,7.6,8.0,350.0,494.0,1.0,2.8,0.32,7.11,2.0,6.0,17.0,270.0,2.0,2.0,camelot,9
4031,RIVER SWAN AFTER C0NF. GARNI KHAD AT CHURURU,HIMACHAL PRADESH,19.5,31.0,6.5,8.1,7.4,7.8,421.0,484.0,1.0,2.7,0.32,4.06,2.0,6.0,14.0,70.0,2.0,2.0,camelot,9
1869,RIVER SWAN D/S  BELA BATHARI (BHANGLA),HIMACHAL PRADESH,24.0,32.0,5.5,7.2,6.7,8.0,371.0,663.0,1.0,2.8,0.32,2.13,2.0,4.0,13.0,140.0,2.0,2.0,camelot,9
3856,RIVER SWAN U/S INDUSTRIAL AREA GAGRET,HIMACHAL PRADESH,19.7,32.0,6.8,7.8,7.3,7.9,346.0,520.0,1.0,2.6,0.32,7.81,2.0,4.0,14.0,160.0,2.0,2.0,camelot,9
3857,RIVER SWAN D/S INDUSTRIAL AREA GAGRET,HIMACHAL PRADESH,19.0,32.3,6.4,7.6,7.5,8.2,362.0,515.0,1.0,2.6,0.32,6.93,2.0,6.0,13.0,140.0,2.0,2.0,camelot,9
3858,RIVER SWAN U/S SANT0SHGARH BRIDGE,HIMACHAL PRADESH,23.0,31.0,5.9,7.3,7.4,7.8,358.0,745.0,1.0,2.5,0.32,2.1,2.0,8.0,13.0,114.0,2.0,2.0,camelot,9
3859,RIVER SWAN U/S UNA T0WN AT GHALLUWAL BRIDGE,HIMACHAL PRADESH,19.0,31.0,6.4,8.2,7.4,8.0,340.0,476.0,1.0,2.8,0.32,2.52,2.0,4.0,17.0,140.0,2.0,2.0,camelot,9
30011,"RIVER SWAN AT DHANGLA VILLAGE, SANT0SHGARH (PUNJAB)",PUNJAB,23.0,26.0,3.9,12.0,7.6,8.5,256.0,475.0,2.0,30.0,0.32,5.59,78.0,130000.0,1300.0,350000.0,17.0,11000.0,camelot,9
4433,RIVER SWAN D/S 0F UNA AT RAMPUR BRIDGE,HIMACHAL PRADESH,16.0,32.0,6.1,7.9,7.4,8.2,259.0,498.0,1.0,4.0,0.32,2.42,2.0,6.0,17.0,170.0,2.0,2.0,camelot,9
2758,"RIVER UJH AT DAM SITE(L.H.S.), KATHUA",JAMMU & KASHMIR,12.0,26.0,7.3,7.5,7.5,8.7,103.0,480.0,1.0,1.0,0.0,0.0,,,,,,,camelot,9
